{
  "id": "character:liu-bei",
  "display_name": "Liu Bei",
  "aliases": [
    "Xuande"
  ],
  "sort_name": "Liu, Bei",
  "given_name_romanization": "Liu Bei",
  "romanization_system": "pinyin",
  "primary_faction_id": "faction:shu",
  "faction_ids": [
    "faction:shu"
  ],
  "historical_basis": "historical",
  "appearances": [
    {
      "game_id": "game:dynasty-warriors-3",
      "role": "playable"
    },
    {
      "game_id": "game:dynasty-warriors-8",
      "role": "playable"
    },
    {
      "game_id": "game:dynasty-warriors-9",
      "role": "playable"
    }
  ],
  "weapon_ids": [
    "weapon:sword"
  ],
  "playstyle_tags": [
    "balanced",
    "beginner-friendly"
  ],
  "relationships": [
    {
      "character_id": "character:zhuge-liang",
      "relation": "lord",
      "spoiler_level": "none",
      "note": "Liu Bei recruits Zhuge Liang as his chief strategist.",
      "provenance": {
        "category": "public_domain_history",
        "contributor": "musoudb_seed",
        "contributed_at": "2026-08-03T00:00:00Z",
        "sources": [
          {
            "kind": "historical_text",
            "citation": "Records of the Three Kingdoms (Sanguozhi), Chen Shou, 3rd century. Public domain.",
            "note": "Summarized in the contributor's own words."
          }
        ]
      }
    },
    {
      "character_id": "character:cao-cao",
      "relation": "rival",
      "spoiler_level": "none",
      "provenance": {
        "category": "community_observation",
        "contributor": "musoudb_seed",
        "contributed_at": "2026-08-03T00:00:00Z",
        "sources": [
          {
            "kind": "in_game_observation",
            "citation": "Verified by a contributor during play; see revision history."
          }
        ]
      }
    }
  ],
  "summary": {
    "blocks": [
      {
        "spoiler_level": "none",
        "text": "The founder of Shu, written throughout the series as the benevolence-first counterweight to Cao Cao's pragmatism.",
        "language": "en"
      }
    ]
  },
  "tags": [
    "kingdom-founder",
    "shu"
  ],
  "provenance": {
    "category": "public_domain_history",
    "contributor": "musoudb_seed",
    "contributed_at": "2026-08-03T00:00:00Z",
    "sources": [
      {
        "kind": "historical_text",
        "citation": "Records of the Three Kingdoms (Sanguozhi), Chen Shou, 3rd century. Public domain.",
        "note": "Summarized in the contributor's own words."
      }
    ]
  },
  "meta": {
    "schema_version": "0",
    "revision": 1,
    "created_at": "2026-08-03T00:00:00Z",
    "updated_at": "2026-08-03T00:00:00Z",
    "status": "accepted"
  }
}
