{
  "id": "character:cao-cao",
  "display_name": "Cao Cao",
  "aliases": [
    "Mengde"
  ],
  "sort_name": "Cao, Cao",
  "given_name_romanization": "Cao Cao",
  "romanization_system": "pinyin",
  "primary_faction_id": "faction:wei",
  "faction_ids": [
    "faction:wei"
  ],
  "historical_basis": "historical",
  "appearances": [
    {
      "game_id": "game:dynasty-warriors-3",
      "role": "playable"
    },
    {
      "game_id": "game:dynasty-warriors-8",
      "role": "playable"
    },
    {
      "game_id": "game:dynasty-warriors-9",
      "role": "playable"
    }
  ],
  "weapon_ids": [
    "weapon:sword"
  ],
  "playstyle_tags": [
    "crowd-clear",
    "beginner-friendly"
  ],
  "relationships": [
    {
      "character_id": "character:liu-bei",
      "relation": "rival",
      "spoiler_level": "none",
      "note": "Framed as opposing visions for the empire in every seeded entry.",
      "provenance": {
        "category": "community_observation",
        "contributor": "musoudb_seed",
        "contributed_at": "2026-08-03T00:00:00Z",
        "sources": [
          {
            "kind": "in_game_observation",
            "citation": "Verified by a contributor during play; see revision history."
          }
        ]
      }
    }
  ],
  "summary": {
    "blocks": [
      {
        "spoiler_level": "none",
        "text": "The founding figure of Wei, presented across the series as a pragmatic and ambitious unifier rather than a straightforward villain.",
        "language": "en"
      },
      {
        "spoiler_level": "minor",
        "text": "Later entries increasingly frame his campaigns as an argument that order must precede virtue.",
        "language": "en",
        "scope_game_ids": [
          "game:dynasty-warriors-8",
          "game:dynasty-warriors-9"
        ]
      }
    ]
  },
  "tags": [
    "kingdom-founder",
    "wei"
  ],
  "provenance": {
    "category": "public_domain_history",
    "contributor": "musoudb_seed",
    "contributed_at": "2026-08-03T00:00:00Z",
    "sources": [
      {
        "kind": "historical_text",
        "citation": "Records of the Three Kingdoms (Sanguozhi), Chen Shou, 3rd century. Public domain.",
        "note": "Summarized in the contributor's own words."
      }
    ]
  },
  "meta": {
    "schema_version": "0",
    "revision": 1,
    "created_at": "2026-08-03T00:00:00Z",
    "updated_at": "2026-08-03T00:00:00Z",
    "status": "accepted"
  }
}
